,Title,Date,Time,Score,Number of Comments
538,Ichiro started tanning in the offseason,2017-04-15,06:40:31,44,1
539,"Dana Vollmer, the Olympic swimmer, racing while six months pregnant",2017-04-15,16:31:56,6,0
540,If youre not watching the NCAA Womens Bowling Championship on ESPNU you need to stop what youre doing and tune in right now.,2017-04-16,03:04:25,0,1
541,Impressive aim,2017-04-14,19:48:52,181,5
542,Greg Hancock | Speedway GP World Champion on Trans World Sport,2017-04-15,16:48:19,3,0
543,Stanley Peterson of the Dallas Roughnecks lays out for the score,2017-04-15,02:19:06,40,8
544,Aaron Hernandez Found Not Guilty on Double Murder Charges,2017-04-14,23:17:04,54,54
545,Today marks the 28th Anniversary of the Hillsborough Diasaster.,2017-04-15,12:30:16,3,0
546,"The White Sox entire outfield has the last name of Garcia tonight, first time in MLB history.",2017-04-15,03:22:01,16,1
547,Crazy snooker shot from Judd Trump,2017-04-14,01:26:21,1814,128
548,"Rod Carews transplanted heart, kidney donated from ex-Ravens TE Konrad Reuland",2017-04-15,07:33:47,6,0
549,Sooo if the Cavs dont win ESPN is gonna send Aaron Hernandez to kill them?,2017-04-15,03:52:26,9,0
550,Front flip throw-in leads to an overhead kick goal!,2017-04-13,16:18:53,14810,814
551,Floyd Mayweather landing clean body shots on Andre Berto,2017-04-14,21:03:00,22,7
552,Intense Robot Soccer w/ Commentary,2017-04-14,21:07:38,19,1
553,[Rugby League] Matt Gillett charge down and game winning pass to James Roberts with 3 minutes left,2017-04-14,16:03:59,28,10
554,Outside the Lines: The downfall of Americas first sport-only college,2017-04-14,18:39:49,17,2
555,I invented a game,2017-04-14,23:41:46,6,5
556,Azizulhasni Awang after 10 years trying to win his first world championship title.,2017-04-14,16:45:06,21,3
557,Hartford Yard Goats season opener in the brand new Dunkin Donuts Park. 4/13/17,2017-04-14,21:00:37,9,3
558,Awesome try assist from Anthony Don,2017-04-14,16:38:20,16,3
559,Rugby Uniform Question,2017-04-14,22:48:10,5,7
560,"Sports in which the player scores, not the ball",2017-04-14,19:35:54,9,25
561,Usain Bolt is only 0.1 seconds away from the fastest a human being can possibly run the 100 meter dash,2017-04-15,12:33:00,0,1
562,Willie Le Roux Blooper vs Leinster. Champions Cup 2016/17,2017-04-14,20:29:26,7,0
563,"Its mid April, can we please get a change to the sidebar pic? (Stanley Cup or NBA playoffs)",2017-04-15,05:45:00,0,2
564,This year Canadiens playoff pre-game show is out of this world,2017-04-14,15:28:08,13,1
565,How do I get into MLB and NBA?,2017-04-15,03:45:59,1,13
566,Japans volleyball team test their spikes against robot blockers,2017-04-13,18:06:53,468,17
567,Ross Barkley: Sun suspends Kelvin MacKenzie over Liverpool article,2017-04-15,03:13:07,0,1
568,Steelers owner Dan Rooney Dies,2017-04-14,00:07:47,145,19
569,What is the most What were you thinking moment in sports history?,2017-04-14,19:16:29,5,15
570,British former world champion Jenson Button will replace Fernando Alonso at McLaren for the Monaco,2017-04-14,20:30:39,3,0
571,"Hang gliding question, all help appreciated!",2017-04-15,01:51:32,1,1
572,Mariners imposing order limit on popular toasted grasshoppers,2017-04-14,18:32:08,3,1
573,Jose Mourinho: Man Utd manager blames forwards for Anderlecht draw,2017-04-14,20:42:43,2,1
574,MLB Team Phone Wallpapers,2017-04-14,20:24:10,3,4
575,Hernandez found not guilty,2017-04-14,23:13:17,0,0
576,[Discussion] Why are there so many phony/exaggerated fouls in professional sports?,2017-04-14,20:57:23,1,20
577,St. Louis suing NFL over Rams relocation,2017-04-12,22:35:49,6894,839
578,Penguins fan stabbed in head refuses treatment until game is over,2017-04-14,03:47:39,18,2
579,Red Wings fans sing Sweet Caroline during the final moments at Joe Louis Arena,2017-04-13,21:24:27,40,5
580,Ducks defeat the Flames to take Game 1 of their first-round playoff series,2017-04-14,16:35:46,1,0
581,"Question about pay in sports - specifically turf/field hockey, preferentially relevant to Australia",2017-04-14,12:33:50,2,2
582,"The finish of every fight at the inaugural Ultimate Fighting Championship. 11/12/93 in Denver, CO",2017-04-14,01:50:18,12,7
583,Money talks,2017-04-13,19:59:18,31,7
584,A catch almost gets dropped.,2017-04-13,20:49:32,17,5
585,Lou Brock undergoing treatment for blood and bone cancer,2017-04-14,01:17:43,8,0
586,Manuel Neuer with the sick save on a point blank shot from Ronaldo,2017-04-13,12:11:14,91,14
587,Can you Lose weight with a jet ski?,2017-04-14,12:15:22,0,11
588,"If every Canadian NHL team up and left, how much money would the league lose?",2017-04-14,03:59:15,4,4
589,Crimson Tides Deionte Thompson wanted in assault case,2017-04-14,08:28:16,1,2
590,Atlantas New Mercedes Benz Stadium to be home of Superbowl LIII,2017-04-13,22:26:26,6,3
591,"[Squash] Commentators mention how they havent seen Paul Superman Coll dive for a ball yet, then he proceeds to perform two of the most outrageous dives ever to win the point. Commentators at a loss for words.",2017-04-13,12:39:26,20,5
592,Raiders now only team in NFL to go three years without an arrest,2017-04-12,03:55:43,22265,729
593,Cristiano Ronaldo becomes the first player in history to score 100 goals in UEFA European competition.,2017-04-13,01:09:45,130,16
594,A moment of cricket,2017-04-12,18:04:08,442,95
595,"Women have played college football before, but Becca Longo might be the first on scholarship",2017-04-13,20:42:34,3,4
596,Insane frisbee shot 79 Meter into basketball basket,2017-04-13,14:49:51,9,1
597,Im searching for basketball drills for kids aged 10-13.,2017-04-13,15:35:34,4,1
598,Blake Griffins custom Air Jordans he designed with 10 year old cancer paitent for auction/charity pass $1000 mark. Clippers match $25k to fight childhood cancers,2017-04-12,14:05:03,770,22
599,The Edmonton Oilers crowd sings the national anthem at their first Stanley Cup Playoff game in a decade,2017-04-13,12:10:16,6,1
600,Good Sportsmanship,2017-04-16,20:57:44,71662,708
601,"19 year old Zach Werenski of the Columbus Blue Jackets after tonights playoff game. Zach took a puck to the face in the 2nd,and returned to play in the 3rd period,but was forced to sit in Overtime because his eye was so swollen.",2017-04-17,06:19:14,74,24
602,Steven Adams Delivers A Hard Screen To Patrick Beverley,2017-04-17,07:32:50,60,14
603,Singapore 7s: Canada defeats USA to win the nations first-ever cup title,2017-04-16,18:00:02,550,45
604,Absolutely ridiculous goal by Radulov (Montreal) vs New York Rangers (3-0),2017-04-17,05:35:49,41,3
605,Crash in formula 4 today,2017-04-16,17:07:47,229,49
606,Isaiah Thomas sister is killed in a car accident.,2017-04-17,11:20:29,7,5
607,Columbus Blue Jackets defenseman Zach Werenski returns to the game after taking a puck to the face.,2017-04-17,04:28:11,19,1
608,Great pitcher play!,2017-04-17,10:14:34,8,0
609,Tying Shoes Penalty Kick,2017-04-15,20:08:08,46262,922
610,Brian Dozier inside the park homerun,2017-04-17,03:02:02,16,0
611,Ive had these for a few years. Not a sports guy but I think theyre pretty cool.,2017-04-17,05:10:19,10,2
612,Met Odell this morning at Easter brunch. Nice fellow,2017-04-16,21:50:40,33,3
613,Ronnie OSullivans 147 - Its good to watch a master at work,2017-04-17,01:34:36,9,0
614,John Walls Million Dollar Offense,2017-04-17,17:26:14,0,0
615,Tic-tac-toe - Habs/rangers game 3,2017-04-17,04:50:46,5,1
616,Draymond Greens stats GM1.,2017-04-17,02:09:20,7,7
617,Bastia vs Lyon game postponed as Bastia fans try to attack Lyon players,2017-04-16,23:05:37,9,0
618,Holy Kapanen: Leafs beat Caps in double-OT thriller,2017-04-16,20:45:28,10,0
619,Perfect Form Tackle,2017-04-17,03:01:35,3,1
620,Ozuna hits Stanton with a liner,2017-04-16,23:36:22,4,1
621,Aluminum bat snaps in half during bat single,2017-04-16,21:01:07,8,3
622,"Today is the 10-Year Anniversary of the Pizza Throw Incident at Fenway Park, May We Never Forget",2017-04-16,00:29:38,244,33
623,Chin breaking out from chinstrap. Help!,2017-04-17,00:01:42,3,4
624,Dream Team Razors from 1991 STILL at grandmas house,2017-04-16,17:39:46,7,4
625,Rally car driver shows off some skill,2017-04-15,04:02:37,41741,1230
626,Amilcar Henriquez was shot and killed in Panamas Colon province,2017-04-16,08:44:40,17,0
627,Spending Easter watching the Phillies and Nationals. Go Phillies!!!,2017-04-16,23:17:22,1,4
628,Tony Adams bringing a new kind of training technique to Granada...,2017-04-16,22:55:45,1,1
629,"Today marks the 28th anniversary of the Hillsborough tragedy, the day 96 Liverpool fans never came home. Y.N.W.A",2017-04-15,16:05:03,269,25
630,Listen to hilarious telugu commentary on the on-going RCBvsRPS IPL Cricket match.,2017-04-16,21:27:06,0,0
631,Everyone loves surfers,2017-04-16,21:17:30,0,2
632,Rachel Daly With A Nice Curler,2017-04-16,00:37:39,43,4
633,F1 driver Max Verstappen overtakes 9 cars on the first lap on a wet track,2017-04-16,01:32:05,31,1
634,Best place to watch live soccer matches?,2017-04-16,19:56:43,1,7
635,Sportstreaming sites,2017-04-16,19:53:39,1,2
636,Monger taken to hospital after British F4 crash,2017-04-16,18:53:20,0,1
637,The fourth Marathon of Friendship Pleven 2017 will be held at 21 May,2017-04-16,18:46:43,1,0
638,Statue of Jackie Robinson unveiled at Dodger Stadium,2017-04-16,04:25:46,13,2
639,"We are at church, but God is watching the NBA and telling us his MVP picks",2017-04-16,21:26:42,0,1
640,Are there any LGBTQ+ players in the MLB?,2017-04-16,23:08:56,0,13
641,21 bold predictions for the 2017 NBA Playoffs,2017-04-16,15:19:42,0,6
642,Fingertip control to keep the ball in play - Super Rugby,2017-04-15,20:22:31,33,4
643,Hockey player gets stick stuck in glass,2017-04-14,14:56:22,22004,517
644,Rally driver showing how small the margin for error is,2017-04-15,21:43:30,18,7
645,Gotta love minor league baseball,2017-04-15,08:29:59,189,11
646,Sportsmanship from Matt Calvert in the Waning Seconds of a Loss,2017-04-15,06:37:08,125,47
647,MMA Fighter goes Zombie Mode and pulls one of the greatest comeback in MMA History,2017-04-14,20:15:37,530,66
648,Todd Heap accidentally kills 3 yr old daughter,2017-04-15,08:47:13,37,16
649,"Dana Vollmer, the Olympic swimmer, racing while six months pregnant",2017-04-15,16:31:56,9,0
650,David Villa goal from halfway line vs Philly,2017-04-15,08:39:23,34,2
651,Ichiro started tanning in the offseason,2017-04-15,06:40:31,50,1
652,If youre not watching the NCAA Womens Bowling Championship on ESPNU you need to stop what youre doing and tune in right now.,2017-04-16,03:04:25,0,2
653,Impressive aim,2017-04-14,19:48:52,183,5
654,Stanley Peterson of the Dallas Roughnecks lays out for the score,2017-04-15,02:19:06,45,8
655,Greg Hancock | Speedway GP World Champion on Trans World Sport,2017-04-15,16:48:19,3,0
656,Aaron Hernandez Found Not Guilty on Double Murder Charges,2017-04-14,23:17:04,57,54
657,Today marks the 28th Anniversary of the Hillsborough Diasaster.,2017-04-15,12:30:16,3,0
658,"The White Sox entire outfield has the last name of Garcia tonight, first time in MLB history.",2017-04-15,03:22:01,14,1
659,"Rod Carews transplanted heart, kidney donated from ex-Ravens TE Konrad Reuland",2017-04-15,07:33:47,6,0
660,Crazy snooker shot from Judd Trump,2017-04-14,01:26:21,1823,128
661,Sooo if the Cavs dont win ESPN is gonna send Aaron Hernandez to kill them?,2017-04-15,03:52:26,10,0
662,Front flip throw-in leads to an overhead kick goal!,2017-04-13,16:18:53,14811,814
663,Floyd Mayweather landing clean body shots on Andre Berto,2017-04-14,21:03:00,24,7
664,Intense Robot Soccer w/ Commentary,2017-04-14,21:07:38,21,1
665,I invented a game,2017-04-14,23:41:46,7,5
666,[Rugby League] Matt Gillett charge down and game winning pass to James Roberts with 3 minutes left,2017-04-14,16:03:59,28,10
667,Outside the Lines: The downfall of Americas first sport-only college,2017-04-14,18:39:49,17,2
668,Azizulhasni Awang after 10 years trying to win his first world championship title.,2017-04-14,16:45:06,23,3
669,Hartford Yard Goats season opener in the brand new Dunkin Donuts Park. 4/13/17,2017-04-14,21:00:37,8,3
670,Usain Bolt is only 0.1 seconds away from the fastest a human being can possibly run the 100 meter dash,2017-04-15,12:33:00,0,1
671,Awesome try assist from Anthony Don,2017-04-14,16:38:20,17,3
672,Rugby Uniform Question,2017-04-14,22:48:10,5,7
673,"Sports in which the player scores, not the ball",2017-04-14,19:35:54,8,26
674,Willie Le Roux Blooper vs Leinster. Champions Cup 2016/17,2017-04-14,20:29:26,7,0
675,"Its mid April, can we please get a change to the sidebar pic? (Stanley Cup or NBA playoffs)",2017-04-15,05:45:00,0,2
676,This year Canadiens playoff pre-game show is out of this world,2017-04-14,15:28:08,13,1
677,How do I get into MLB and NBA?,2017-04-15,03:45:59,1,13
678,Japans volleyball team test their spikes against robot blockers,2017-04-13,18:06:53,472,16
679,Ross Barkley: Sun suspends Kelvin MacKenzie over Liverpool article,2017-04-15,03:13:07,0,1
680,Steelers owner Dan Rooney Dies,2017-04-14,00:07:47,147,19
681,What is the most What were you thinking moment in sports history?,2017-04-14,19:16:29,4,15
682,British former world champion Jenson Button will replace Fernando Alonso at McLaren for the Monaco,2017-04-14,20:30:39,3,0
683,"Hang gliding question, all help appreciated!",2017-04-15,01:51:32,1,1
684,Mariners imposing order limit on popular toasted grasshoppers,2017-04-14,18:32:08,3,1
685,Jose Mourinho: Man Utd manager blames forwards for Anderlecht draw,2017-04-14,20:42:43,2,1
686,MLB Team Phone Wallpapers,2017-04-14,20:24:10,2,4
687,Hernandez found not guilty,2017-04-14,23:13:17,0,0
688,[Discussion] Why are there so many phony/exaggerated fouls in professional sports?,2017-04-14,20:57:23,1,20
689,St. Louis suing NFL over Rams relocation,2017-04-12,22:35:49,6889,839
690,Penguins fan stabbed in head refuses treatment until game is over,2017-04-14,03:47:39,20,2
691,Red Wings fans sing Sweet Caroline during the final moments at Joe Louis Arena,2017-04-13,21:24:27,36,5
692,Ducks defeat the Flames to take Game 1 of their first-round playoff series,2017-04-14,16:35:46,1,0
693,"Question about pay in sports - specifically turf/field hockey, preferentially relevant to Australia",2017-04-14,12:33:50,2,2
694,"The finish of every fight at the inaugural Ultimate Fighting Championship. 11/12/93 in Denver, CO",2017-04-14,01:50:18,12,8
695,Money talks,2017-04-13,19:59:18,30,7
696,A catch almost gets dropped.,2017-04-13,20:49:32,21,5
697,Lou Brock undergoing treatment for blood and bone cancer,2017-04-14,01:17:43,7,0
698,Manuel Neuer with the sick save on a point blank shot from Ronaldo,2017-04-13,12:11:14,91,14
699,Can you Lose weight with a jet ski?,2017-04-14,12:15:22,1,11
700,Ranking colleges by D1 sports championships.,2017-04-17,20:57:40,1720,491
701,Isaiah Thomas Was Emotional Prior To Game 1 Following His Sisters Death On Saturday,2017-04-17,19:56:42,1605,91
702,"Guy takes pic at the Boston Marathon of a motivational sign, refuses to let ESPN use his picture with the funniest response",2017-04-18,04:39:12,83,16
703,[x-post r/Warriors] Stephen Curry Does Not Get Foul Calls,2017-04-18,03:47:40,73,9
704,Good Sportsmanship,2017-04-16,20:57:44,74101,723
705,Steven Adams Delivers A Hard Screen To Patrick Beverley,2017-04-17,07:32:50,640,96
706,Hockey Hail Mary,2017-04-18,04:54:06,12,3
707,Football Nicknames Quiz has No Chill,2017-04-18,03:27:47,12,1
708,Cricket: Flying save at the boundary.,2017-04-17,21:16:54,27,6
709,"19 year old Zach Werenski of the Columbus Blue Jackets after tonights playoff game. Zach took a puck to the face in the 2nd,and returned to play in the 3rd period,but was forced to sit in Overtime because his eye was so swollen.",2017-04-17,06:19:14,311,41
710,Copenhagen Fans Throw Dead Rats Onto Field,2017-04-18,00:27:43,9,11
711,Kenyas Geoffrey Kirui pulls away from American Galen Rupp for win in 121st Boston Marathon.,2017-04-17,20:12:35,16,14
712,Terry to leave Chelsea at end of season after 22 years,2017-04-18,01:46:43,6,4
713,Stephen A. Smith golf disgusts me sometimes,2017-04-18,02:44:08,4,7
714,Brighton players join fans on the train after promotion to premier league!,2017-04-18,03:30:19,3,2
715,Marine who lost leg in Afghanistan runs Boston Marathon with U.S. flag,2017-04-18,05:24:41,1,0
716,The ESPN app should have an option to alert you when a game returns from halftime,2017-04-18,04:14:39,2,0
717,Magic pass for a try,2017-04-18,01:22:50,3,0
718,Absolutely ridiculous goal by Radulov (Montreal) vs New York Rangers (3-0),2017-04-17,05:35:49,93,6
719,If all players were in their prime who would be the best NBA team rn?,2017-04-18,06:13:35,1,5
720,Dart Guy,2017-04-18,05:23:11,1,1
721,Is your states income tax keeping star athletes away?,2017-04-18,05:15:36,1,1
722,The amazing save by Holtby,2017-04-18,04:54:06,1,0
723,Singapore 7s: Canada defeats USA to win the nations first-ever cup title,2017-04-16,18:00:02,556,52
724,2017 NBA All Star Endorsement Search Database,2017-04-18,02:20:28,1,0
725,Why no Nascar for motorbikes?,2017-04-17,21:10:13,2,5
726,Columbus Blue Jackets defenseman Zach Werenski returns to the game after taking a puck to the face.,2017-04-17,04:28:11,35,3
727,Great pitcher play!,2017-04-17,10:14:34,12,0
728,Crash in formula 4 today,2017-04-16,17:07:47,235,50
729,"Shaken at the start, Celtics drop Game 1 of playoff series vs. Bulls",2017-04-17,18:24:08,2,0
730,Brian Dozier inside the park homerun,2017-04-17,03:02:02,25,3
731,Tying Shoes Penalty Kick,2017-04-15,20:08:08,46298,923
732,Ive had these for a few years. Not a sports guy but I think theyre pretty cool.,2017-04-17,05:10:19,13,2
733,Met Odell this morning at Easter brunch. Nice fellow,2017-04-16,21:50:40,43,4
734,Ronnie OSullivans 147 - Its good to watch a master at work,2017-04-17,01:34:36,20,0
735,Isaiah Thomas sister is killed in a car accident.,2017-04-17,11:20:29,3,6
736,Tic-tac-toe - Habs/rangers game 3,2017-04-17,04:50:46,7,1
737,Draymond Greens stats GM1.,2017-04-17,02:09:20,6,7
738,Bastia vs Lyon game postponed as Bastia fans try to attack Lyon players,2017-04-16,23:05:37,9,3
739,Holy Kapanen: Leafs beat Caps in double-OT thriller,2017-04-16,20:45:28,12,0
740,Ozuna hits Stanton with a liner,2017-04-16,23:36:22,6,1
741,Perfect Form Tackle,2017-04-17,03:01:35,3,1
742,Aluminum bat snaps in half during bat single,2017-04-16,21:01:07,8,3
743,"Today is the 10-Year Anniversary of the Pizza Throw Incident at Fenway Park, May We Never Forget",2017-04-16,00:29:38,248,33
744,Dream Team Razors from 1991 STILL at grandmas house,2017-04-16,17:39:46,8,4
745,Chin breaking out from chinstrap. Help!,2017-04-17,00:01:42,3,4
746,Rally car driver shows off some skill,2017-04-15,04:02:37,41764,1232
747,Spending Easter watching the Phillies and Nationals. Go Phillies!!!,2017-04-16,23:17:22,2,4
748,Amilcar Henriquez was shot and killed in Panamas Colon province,2017-04-16,08:44:40,17,0
749,Tony Adams bringing a new kind of training technique to Granada...,2017-04-16,22:55:45,1,1
750,"Today marks the 28th anniversary of the Hillsborough tragedy, the day 96 Liverpool fans never came home. Y.N.W.A",2017-04-15,16:05:03,266,24
751,Listen to hilarious telugu commentary on the on-going RCBvsRPS IPL Cricket match.,2017-04-16,21:27:06,0,0
752,Everyone loves surfers,2017-04-16,21:17:30,0,2
753,Rachel Daly With A Nice Curler,2017-04-16,00:37:39,45,4
754,F1 driver Max Verstappen overtakes 9 cars on the first lap on a wet track,2017-04-16,01:32:05,31,1
755,Best place to watch live soccer matches?,2017-04-16,19:56:43,1,9
756,Sportstreaming sites,2017-04-16,19:53:39,1,2
757,Are there any LGBTQ+ players in the MLB?,2017-04-16,23:08:56,0,13
758,Statue of Jackie Robinson unveiled at Dodger Stadium,2017-04-16,04:25:46,15,2
759,Monger taken to hospital after British F4 crash,2017-04-16,18:53:20,0,1
760,The fourth Marathon of Friendship Pleven 2017 will be held at 21 May,2017-04-16,18:46:43,1,0
761,"We are at church, but God is watching the NBA and telling us his MVP picks",2017-04-16,21:26:42,0,1
762,Fingertip control to keep the ball in play - Super Rugby,2017-04-15,20:22:31,34,4
763,21 bold predictions for the 2017 NBA Playoffs,2017-04-16,15:19:42,2,6
764,Hockey player gets stick stuck in glass,2017-04-14,14:56:22,22006,516
765,Rally driver showing how small the margin for error is,2017-04-15,21:43:30,20,7
766,Gotta love minor league baseball,2017-04-15,08:29:59,188,11
767,Sportsmanship from Matt Calvert in the Waning Seconds of a Loss,2017-04-15,06:37:08,122,47
768,MMA Fighter goes Zombie Mode and pulls one of the greatest comeback in MMA History,2017-04-14,20:15:37,535,66
769,Todd Heap accidentally kills 3 yr old daughter,2017-04-15,08:47:13,43,16
770,David Villa goal from halfway line vs Philly,2017-04-15,08:39:23,41,2
771,Ichiro started tanning in the offseason,2017-04-15,06:40:31,51,2
772,If youre not watching the NCAA Womens Bowling Championship on ESPNU you need to stop what youre doing and tune in right now.,2017-04-16,03:04:25,0,2
773,Impressive aim,2017-04-14,19:48:52,183,5
774,Stanley Peterson of the Dallas Roughnecks lays out for the score,2017-04-15,02:19:06,44,8
775,Greg Hancock | Speedway GP World Champion on Trans World Sport,2017-04-15,16:48:19,3,0
776,Aaron Hernandez Found Not Guilty on Double Murder Charges,2017-04-14,23:17:04,57,53
777,Today marks the 28th Anniversary of the Hillsborough Diasaster.,2017-04-15,12:30:16,6,0
778,"The White Sox entire outfield has the last name of Garcia tonight, first time in MLB history.",2017-04-15,03:22:01,15,1
779,"Rod Carews transplanted heart, kidney donated from ex-Ravens TE Konrad Reuland",2017-04-15,07:33:47,7,0
780,Crazy snooker shot from Judd Trump,2017-04-14,01:26:21,1825,129
781,Sooo if the Cavs dont win ESPN is gonna send Aaron Hernandez to kill them?,2017-04-15,03:52:26,10,0
782,Front flip throw-in leads to an overhead kick goal!,2017-04-13,16:18:53,14817,814
783,Floyd Mayweather landing clean body shots on Andre Berto,2017-04-14,21:03:00,28,7
784,Intense Robot Soccer w/ Commentary,2017-04-14,21:07:38,20,1
785,I invented a game,2017-04-14,23:41:46,8,5
786,[Rugby League] Matt Gillett charge down and game winning pass to James Roberts with 3 minutes left,2017-04-14,16:03:59,30,10
787,Outside the Lines: The downfall of Americas first sport-only college,2017-04-14,18:39:49,16,2
788,Hartford Yard Goats season opener in the brand new Dunkin Donuts Park. 4/13/17,2017-04-14,21:00:37,10,3
789,Azizulhasni Awang after 10 years trying to win his first world championship title.,2017-04-14,16:45:06,20,3
790,Usain Bolt is only 0.1 seconds away from the fastest a human being can possibly run the 100 meter dash,2017-04-15,12:33:00,0,1
791,Awesome try assist from Anthony Don,2017-04-14,16:38:20,16,3
792,Rugby Uniform Question,2017-04-14,22:48:10,5,7
793,Willie Le Roux Blooper vs Leinster. Champions Cup 2016/17,2017-04-14,20:29:26,5,0
794,"Its mid April, can we please get a change to the sidebar pic? (Stanley Cup or NBA playoffs)",2017-04-15,05:45:00,0,2
795,This year Canadiens playoff pre-game show is out of this world,2017-04-14,15:28:08,13,1
796,How do I get into MLB and NBA?,2017-04-15,03:45:59,1,13
797,Japans volleyball team test their spikes against robot blockers,2017-04-13,18:06:53,472,17
798,Ross Barkley: Sun suspends Kelvin MacKenzie over Liverpool article,2017-04-15,03:13:07,0,1
799,Steelers owner Dan Rooney Dies,2017-04-14,00:07:47,148,19
800,"Guy takes pic at the Boston Marathon of a motivational sign, refuses to let ESPN use his picture with the funniest response",2017-04-18,04:39:12,18649,1151
801,"20 years ago this month, Ronnie The Rocket OSullivan made the fastest ever maximum in Snooker, a record still standing today and will likely never be beaten",2017-04-18,20:23:38,150,16
802,Ranking colleges by D1 sports championships.,2017-04-17,20:57:40,2092,576
803,Isaiah Thomas Was Emotional Prior To Game 1 Following His Sisters Death On Saturday,2017-04-17,19:56:42,2057,105
804,Take that for data! Head Coach of Memphis Grizzlies criticizes officiating after Game 2,2017-04-18,19:50:17,19,3
805,[x-post r/Warriors] Stephen Curry Does Not Get Foul Calls,2017-04-18,03:47:40,245,94
806,I wish i could watch more hockey games without commentators. The pure sound of the game is amazing.,2017-04-18,23:22:07,7,2
807,Video shows Ohio HS FB team throwing game after it found out it was jobbed into a forfeit,2017-04-18,23:42:27,6,1
808,Incredible Diving Stick Save By Pekka Rinne,2017-04-18,17:01:40,17,8
809,Barry Bonds hitting his 756th home run to become the all time career home run leader.,2017-04-18,18:08:09,15,34
810,How the race organizers allow crowds to pass over Beacon Street during the Boston marathon,2017-04-18,20:11:30,7,1
811,Hockey Hail Mary,2017-04-18,04:54:06,63,10
812,Pittsburgh Pirates Starling Marte suspended 80 games due to testing positive for PEDs,2017-04-18,23:15:58,2,1
813,Burgess uses head to beat shoulder charge,2017-04-18,15:49:01,8,1
814,First woman to officially run Boston Marathon finishes race again at 70,2017-04-18,07:32:27,21,0
815,"Capitals fail to Own the big moments, fall behind in first-round series vs. Toronto",2017-04-18,13:13:50,8,2
816,Babe Ruths 700th Homerun on Friday the 13th! (1934),2017-04-18,07:56:22,17,4
817,Riley Nash Whistled For Roughing After Retaliating With A Punch,2017-04-18,17:16:31,3,3
818,Good Sportsmanship,2017-04-16,20:57:44,74236,723
819,Skipping the White House: Chris Long and Devin McCourty Add Their Voices to New England Patriots Fan Video.,2017-04-18,20:45:08,2,0
820,Kristen Ledlow talks with Kyrie Irving following the Cavaliers game 2 victory over Indiana.,2017-04-18,20:37:08,1,1
821,Cricket: Flying save at the boundary.,2017-04-17,21:16:54,68,9
822,Steven Adams Delivers A Hard Screen To Patrick Beverley,2017-04-17,07:32:50,663,101
823,Highlight of Pekka Rinnes insane save against the Blackhawks during tonights game (4/17/17),2017-04-18,07:58:15,7,2
824,Marine who lost leg in Afghanistan runs Boston Marathon with U.S. flag,2017-04-18,05:24:41,12,3
