,Title,Date,Time,Score,Number of Comments
263,"Watch Pacers, Raptors Scuffle After Lance Stephensons Garbage-Time Layup",2017-04-13,00:19:46,0,1
264,An Americans first soccer game: VfB Stuttgart - Karlsruher SC,2017-04-11,19:19:24,91,13
265,Tony Romo introduced at Mavericks game,2017-04-12,06:22:24,10,14
266,Can someone stop Real Madrid?,2017-04-13,00:42:03,0,3
267,Brooklyn Nets will rest Big 6 against playoff-aspiring Bulls,2017-04-12,08:00:02,6,8
268,OTD in 2001 Ichiro made The Throw,2017-04-12,00:32:39,18,3
269,People in Dortmund are offering Monaco fans free accomodation by hashtagging #bedforawayfans,2017-04-12,01:11:41,16,1
270,"Masters green jacket found in thrift store sold at auction for nearly $140,000",2017-04-11,23:19:57,19,0
271,"Tony Romo, Who Will Wear A Full Uniform And Sit On The Bench Tonight, Practicing With The Mavericks",2017-04-12,00:35:39,13,3
272,Jonathan Simmons Dunks Over Meyers Leonard,2017-04-11,19:42:01,33,6
273,Wil Myers Cycle! How is it possible that all 4 of the balls were kept and authenticated. Crazy.,2017-04-11,22:26:07,17,10
274,"Were The Phillies fans just chanting, YOU SUCK, and cespedes hit a 3 run homer?",2017-04-12,03:22:26,7,5
275,Tony Romo joins the Dallas Mavericks for last game of the season.,2017-04-11,23:27:51,10,1
276,Why do people feel the need to film football matches on their phone?,2017-04-12,02:53:32,3,6
277,Wades incredible run-out.,2017-04-11,16:20:03,26,25
278,What if Conor does beat Mayweather?,2017-04-11,19:20:39,6,21
279,Marshawn Lynch Expressed Interest In Joining Patriots If Raiders Deal Falls,2017-04-11,21:38:19,3,4
280,Sergio Garcia wins the 2017 Masters on the first hole of sudden death versus Justin Rose.,2017-04-10,03:30:22,22094,724
281,Walcott-We all let the fans down tonight,2017-04-11,14:19:34,10,3
282,Wil Myers hits for historic cycle with this triple!,2017-04-11,07:43:35,24,7
283,A simple explanation of the rules of cricket,2017-04-11,04:01:53,40,12
284,"Buster Posey Takes Fastball To The Head, Leaves Game",2017-04-11,01:43:43,54,25
285,Tony Romo practicing with his new team.,2017-04-11,23:17:49,1,0
286,"United States, Canada, and Mexico Declare Intention to Submit Unified Bid to Host 2026 FIFA World Cup",2017-04-10,23:04:14,71,25
287,"Rizzo, Cubs raise banner, beat Dodgers 3-2 in home opener",2017-04-11,14:06:07,6,0
288,"Tennis Player Hurdles Into The Stands, Still Returns Shot",2017-04-10,20:53:45,87,11
289,Crystal Palace Fans Taunt Arsenal Manager Arsene Wenger While Leading 3-0,2017-04-11,00:59:00,37,9
290,"Boxer Slips Punches, Taunts Opponent",2017-04-10,23:41:09,30,3
291,Tristan Jarry makes an unbelievable save in his first ever game,2017-04-10,23:22:25,26,3
292,To Cubs fans,2017-04-11,16:43:04,0,1
293,Boulware Displays All of the Clemson Championship Rings,2017-04-11,00:27:57,17,0
294,"Opening night ceremony, McCoy stadium, Pawtucket, Rhode Island. April 10th, 2017.",2017-04-11,02:21:23,12,1
295,Champions League: Dortmund out to score as many goals as possible against Monaco,2017-04-11,14:47:13,1,2
296,"Buster Posey gets beaned, Giants prevail in home opener",2017-04-11,08:45:00,3,0
297,AB De Villiers showing why they call him the Superman of cricket.,2017-04-11,01:12:08,13,0
298,Phillies to induct Rose into clubs Wall of Fame,2017-04-11,04:07:32,6,1
299,Ric Flair kicked out of Fort Wayne bar for good.,2017-04-10,23:34:04,16,13
300,Hockey player gets stick stuck in glass,2017-04-14,14:56:22,8365,291
301,Crazy snooker shot from Judd Trump,2017-04-14,01:26:21,1658,106
302,Front flip throw-in leads to an overhead kick goal!,2017-04-13,16:18:53,14707,806
303,Outside the Lines: The downfall of Americas first sport-only college,2017-04-14,18:39:49,8,0
304,[Rugby League] Matt Gillett charge down and game winning pass to James Roberts with 3 minutes left,2017-04-14,16:03:59,12,5
305,Japans volleyball team test their spikes against robot blockers,2017-04-13,18:06:53,453,17
306,Awesome try assist from Anthony Don,2017-04-14,16:38:20,6,2
307,Steelers owner Dan Rooney Dies,2017-04-14,00:07:47,138,19
308,Azizulhasni Awang after 10 years trying to win his first world championship title.,2017-04-14,16:45:06,6,3
309,This year Canadiens playoff pre-game show is out of this world,2017-04-14,15:28:08,6,1
310,Mariners imposing order limit on popular toasted grasshoppers,2017-04-14,18:32:08,3,0
311,Impressive aim,2017-04-14,19:48:52,2,0
312,"Sports in which the player scores, not the ball",2017-04-14,19:35:54,2,4
313,St. Louis suing NFL over Rams relocation,2017-04-12,22:35:49,6875,841
314,Chicago Bulls vs Boston Celtics Preview & Prediction,2017-04-14,19:20:00,1,0
315,What is the most What were you thinking moment in sports history?,2017-04-14,19:16:29,1,1
316,Bow to the King,2017-04-14,18:49:51,0,0
317,Giants defend Eli Manning amid claim of false memorabilia,2017-04-14,11:15:57,4,1
318,Penguins fan stabbed in head refuses treatment until game is over,2017-04-14,03:47:39,17,1
319,Ducks defeat the Flames to take Game 1 of their first-round playoff series,2017-04-14,16:35:46,1,0
320,"Question about pay in sports - specifically turf/field hockey, preferentially relevant to Australia",2017-04-14,12:33:50,2,1
321,Red Wings fans sing Sweet Caroline during the final moments at Joe Louis Arena,2017-04-13,21:24:27,27,5
322,Money talks,2017-04-13,19:59:18,28,6
323,"The finish of every fight at the inaugural Ultimate Fighting Championship. 11/12/93 in Denver, CO",2017-04-14,01:50:18,7,8
324,Can you Lose weight with a jet ski?,2017-04-14,12:15:22,1,11
325,Manuel Neuer with the sick save on a point blank shot from Ronaldo,2017-04-13,12:11:14,86,13
326,A catch almost gets dropped.,2017-04-13,20:49:32,16,4
327,Lou Brock undergoing treatment for blood and bone cancer,2017-04-14,01:17:43,8,0
328,"If every Canadian NHL team up and left, how much money would the league lose?",2017-04-14,03:59:15,3,2
329,Crimson Tides Deionte Thompson wanted in assault case,2017-04-14,08:28:16,1,1
330,Atlantas New Mercedes Benz Stadium to be home of Superbowl LIII,2017-04-13,22:26:26,4,3
331,"Bill Belichick on leadership, winning, and Tom Brady not being a great natural athlete",2017-04-13,21:00:51,6,2
332,"[Squash] Commentators mention how they havent seen Paul Superman Coll dive for a ball yet, then he proceeds to perform two of the most outrageous dives ever to win the point. Commentators at a loss for words.",2017-04-13,12:39:26,20,4
333,Raiders now only team in NFL to go three years without an arrest,2017-04-12,03:55:43,22234,731
334,Cristiano Ronaldo becomes the first player in history to score 100 goals in UEFA European competition.,2017-04-13,01:09:45,129,16
335,"WWIII coming right up. Fuck the FBI, fuck Trump, fuck the hells angels, fuck the CIA, fuck big oil, fuck Hootie and the Blowfish.",2017-04-14,18:26:39,0,12
336,A moment of cricket,2017-04-12,18:04:08,442,88
337,"Women have played college football before, but Becca Longo might be the first on scholarship",2017-04-13,20:42:34,3,4
338,Im searching for basketball drills for kids aged 10-13.,2017-04-13,15:35:34,6,1
339,Eli manning is scamming memorabilia dealers,2017-04-14,04:35:31,0,3
340,Insane frisbee shot 79 Meter into basketball basket,2017-04-13,14:49:51,8,1
341,Blake Griffins custom Air Jordans he designed with 10 year old cancer paitent for auction/charity pass $1000 mark. Clippers match $25k to fight childhood cancers,2017-04-12,14:05:03,769,22
342,Rips Modest Proposal: End Mens and Womens Divisions in Sports,2017-04-14,03:27:12,0,5
343,"Tanner Glass, oft referred to as the worst player in the NHL, scores a ridiculous game winning goal in the playoffs. (X-Post r/hockey)",2017-04-13,06:55:46,16,7
344,The Edmonton Oilers crowd sings the national anthem at their first Stanley Cup Playoff game in a decade,2017-04-13,12:10:16,6,1
345,Cool article about the possibility of investors buying and selling soccer players like stocks,2017-04-13,11:46:42,4,3
346,Austin Landis is an Olympic hopeful for Team USAs bobsled team,2017-04-13,20:25:54,1,0
347,[GIF] Julius Blue Machine Indongo (21-0) Knocks Out Eduard Troyanovsky (25-0): KO of the Year 2016,2017-04-13,02:40:36,25,3
348,Batsman changes his Batting Stance after the ball is bowled,2017-04-13,02:51:45,20,13
349,"Shoeless John Daly drives a ball off a beer can and chugs it, all while smoking",2017-04-13,01:50:32,17,1
350,Mike Tyson goes full matrix dodging punches (xpost r/boxing),2017-04-11,18:11:06,9096,938
351,"Proposed bill would force North Carolina, N.C. State to leave ACC due to boycott",2017-04-13,00:54:09,13,19
352,Islamic extremists reported to be behind Borussia Dortmund team bus explosions,2017-04-12,19:57:28,27,14
353,If 3 years ago today someone told you that the Leafs and Oilers would make the playoffs in 2016/17 and the Red Wings would miss... How would you have ranked the likelihood of each?,2017-04-13,07:30:06,1,2
354,"Fernando Alonso, McLaren driver to miss Monaco Grand Prix for Indianapolis 500",2017-04-12,16:00:34,32,10
355,Line Drive Barely Misses Pitchers Head,2017-04-13,01:25:12,5,3
356,How would the Premier League look if clubs could only use local players?,2017-04-12,16:57:22,21,16
357,"Steph Curry and Steve Kerr of the Golden State Warriors, last game of the regular season VS LA Lakers (our first NBA game)",2017-04-13,11:36:07,0,0
358,Atlanta Braves foam tomahawks cause delays on I-75 near Marietta,2017-04-12,21:54:00,3,2
359,Incredible rugby TRY - Stormers vs Chiefs,2017-04-12,09:24:32,43,3
360,Manchester United players make dreams come true for young fans with life-limiting illnesses,2017-04-12,16:28:20,8,0
361,"Explosion hits bus carrying Borussia Dortmund team,injuring Marc Barta",2017-04-11,22:09:47,206,55
362,DortmundMonaco game postponed after bus explosion,2017-04-12,16:55:09,5,4
363,Bayern vs Real Madrid 1-2 Full Highlights Champions League 12/04/2017 HD,2017-04-13,00:53:26,0,0
364,Fan who Dolan yelled at prevented from renewing season Knicks tickets,2017-04-12,18:17:35,3,2
365,Borussia Dortmund show that football is more than just what happens on the pitch by offering a place to stay for Monaco fans who traveled to Germany ahead of the game which was postponed.,2017-04-12,02:22:58,37,0
366,"Bettor wins $42,000 on a $60 bet for Sergio Garcia to win the Masters",2017-04-12,11:10:58,4,2
367,"Watch Pacers, Raptors Scuffle After Lance Stephensons Garbage-Time Layup",2017-04-13,00:19:46,0,1
368,An Americans first soccer game: VfB Stuttgart - Karlsruher SC,2017-04-11,19:19:24,91,13
369,Tony Romo introduced at Mavericks game,2017-04-12,06:22:24,10,14
370,Can someone stop Real Madrid?,2017-04-13,00:42:03,0,3
371,Brooklyn Nets will rest Big 6 against playoff-aspiring Bulls,2017-04-12,08:00:02,7,8
372,OTD in 2001 Ichiro made The Throw,2017-04-12,00:32:39,21,3
373,People in Dortmund are offering Monaco fans free accomodation by hashtagging #bedforawayfans,2017-04-12,01:11:41,16,1
374,"Masters green jacket found in thrift store sold at auction for nearly $140,000",2017-04-11,23:19:57,19,0
375,"Tony Romo, Who Will Wear A Full Uniform And Sit On The Bench Tonight, Practicing With The Mavericks",2017-04-12,00:35:39,15,3
376,Jonathan Simmons Dunks Over Meyers Leonard,2017-04-11,19:42:01,31,6
377,Wil Myers Cycle! How is it possible that all 4 of the balls were kept and authenticated. Crazy.,2017-04-11,22:26:07,16,10
378,"Were The Phillies fans just chanting, YOU SUCK, and cespedes hit a 3 run homer?",2017-04-12,03:22:26,5,5
379,Tony Romo joins the Dallas Mavericks for last game of the season.,2017-04-11,23:27:51,10,1
380,Why do people feel the need to film football matches on their phone?,2017-04-12,02:53:32,7,6
381,Wades incredible run-out.,2017-04-11,16:20:03,29,25
382,What if Conor does beat Mayweather?,2017-04-11,19:20:39,8,21
383,Marshawn Lynch Expressed Interest In Joining Patriots If Raiders Deal Falls,2017-04-11,21:38:19,3,4
384,Sergio Garcia wins the 2017 Masters on the first hole of sudden death versus Justin Rose.,2017-04-10,03:30:22,22093,724
385,Walcott-We all let the fans down tonight,2017-04-11,14:19:34,9,3
386,Wil Myers hits for historic cycle with this triple!,2017-04-11,07:43:35,25,7
387,A simple explanation of the rules of cricket,2017-04-11,04:01:53,43,12
388,"Buster Posey Takes Fastball To The Head, Leaves Game",2017-04-11,01:43:43,55,25
389,Tony Romo practicing with his new team.,2017-04-11,23:17:49,1,0
390,"United States, Canada, and Mexico Declare Intention to Submit Unified Bid to Host 2026 FIFA World Cup",2017-04-10,23:04:14,74,25
391,"Rizzo, Cubs raise banner, beat Dodgers 3-2 in home opener",2017-04-11,14:06:07,5,0
392,"Tennis Player Hurdles Into The Stands, Still Returns Shot",2017-04-10,20:53:45,84,11
393,Crystal Palace Fans Taunt Arsenal Manager Arsene Wenger While Leading 3-0,2017-04-11,00:59:00,30,9
394,"Boxer Slips Punches, Taunts Opponent",2017-04-10,23:41:09,28,3
395,Tristan Jarry makes an unbelievable save in his first ever game,2017-04-10,23:22:25,27,3
396,To Cubs fans,2017-04-11,16:43:04,0,1
397,Boulware Displays All of the Clemson Championship Rings,2017-04-11,00:27:57,16,0
398,"Opening night ceremony, McCoy stadium, Pawtucket, Rhode Island. April 10th, 2017.",2017-04-11,02:21:23,13,1
399,Champions League: Dortmund out to score as many goals as possible against Monaco,2017-04-11,14:47:13,1,2
400,Tying Shoes Penalty Kick,2017-04-15,20:08:08,4117,168
401,Rally car driver shows off some skill,2017-04-15,04:02:37,41044,1216
402,"Today marks the 28th anniversary of the Hillsborough tragedy, the day 96 Liverpool fans never came home. Y.N.W.A",2017-04-15,16:05:03,170,9
403,Hockey player gets stick stuck in glass,2017-04-14,14:56:22,21942,519
404,Gotta love minor league baseball,2017-04-15,08:29:59,133,7
405,Rally driver showing how small the margin for error is,2017-04-15,21:43:30,7,5
406,Sportsmanship from Matt Calvert in the Waning Seconds of a Loss,2017-04-15,06:37:08,92,40
407,MMA Fighter goes Zombie Mode and pulls one of the greatest comeback in MMA History,2017-04-14,20:15:37,495,61
408,Fingertip control to keep the ball in play - Super Rugby,2017-04-15,20:22:31,6,0
409,Todd Heap accidentally kills 3 yr old daughter,2017-04-15,08:47:13,31,11
410,David Villa goal from halfway line vs Philly,2017-04-15,08:39:23,25,2
411,"Shalane Flanagans recovery, final goals and life as a foster parent.",2017-04-15,21:41:27,2,0
412,Ichiro started tanning in the offseason,2017-04-15,06:40:31,25,1
413,"Dana Vollmer, the Olympic swimmer, racing while six months pregnant",2017-04-15,16:31:56,5,0
414,Impressive aim,2017-04-14,19:48:52,169,5
415,Flawless Corkscrew Moonsault,2017-04-15,22:32:37,0,1
416,Ex-NFL player Todd Heap accidentally kills 3-year-old daughter,2017-04-15,22:29:51,1,1
417,Today marks the 28th Anniversary of the Hillsborough Diasaster.,2017-04-15,12:30:16,8,0
418,Aaron Hernandez Found Not Guilty on Double Murder Charges,2017-04-14,23:17:04,53,52
419,Stanley Peterson of the Dallas Roughnecks lays out for the score,2017-04-15,02:19:06,29,6
420,Greg Hancock | Speedway GP World Champion on Trans World Sport,2017-04-15,16:48:19,2,0
421,PokerSesh - POKER IS NOT A TEAM SPORT!,2017-04-15,20:12:39,1,1
422,LEAKED Mayweather/McGregor Fight Poster,2017-04-15,06:34:54,9,16
423,Crazy snooker shot from Judd Trump,2017-04-14,01:26:21,1797,126
424,"The White Sox entire outfield has the last name of Garcia tonight, first time in MLB history.",2017-04-15,03:22:01,12,0
425,"Rod Carews transplanted heart, kidney donated from ex-Ravens TE Konrad Reuland",2017-04-15,07:33:47,5,0
426,Front flip throw-in leads to an overhead kick goal!,2017-04-13,16:18:53,14802,816
427,Sooo if the Cavs dont win ESPN is gonna send Aaron Hernandez to kill them?,2017-04-15,03:52:26,6,0
428,Floyd Mayweather landing clean body shots on Andre Berto,2017-04-14,21:03:00,21,7
429,Usain Bolt is only 0.1 seconds away from the fastest a human being can possibly run the 100 meter dash,2017-04-15,12:33:00,0,1
430,Todd is in a Heap of trouble,2017-04-15,22:08:07,0,2
431,Outside the Lines: The downfall of Americas first sport-only college,2017-04-14,18:39:49,15,2
432,[Rugby League] Matt Gillett charge down and game winning pass to James Roberts with 3 minutes left,2017-04-14,16:03:59,23,10
433,Intense Robot Soccer w/ Commentary,2017-04-14,21:07:38,9,1
434,Azizulhasni Awang after 10 years trying to win his first world championship title.,2017-04-14,16:45:06,17,3
435,Hartford Yard Goats season opener in the brand new Dunkin Donuts Park. 4/13/17,2017-04-14,21:00:37,7,2
436,Rugby Uniform Question,2017-04-14,22:48:10,5,5
437,I invented a game,2017-04-14,23:41:46,5,5
438,"Sports in which the player scores, not the ball",2017-04-14,19:35:54,8,21
439,Awesome try assist from Anthony Don,2017-04-14,16:38:20,12,3
440,"Its mid April, can we please get a change to the sidebar pic? (Stanley Cup or NBA playoffs)",2017-04-15,05:45:00,0,2
441,This year Canadiens playoff pre-game show is out of this world,2017-04-14,15:28:08,11,1
442,How do I get into MLB and NBA?,2017-04-15,03:45:59,1,12
443,Japans volleyball team test their spikes against robot blockers,2017-04-13,18:06:53,469,17
444,Ross Barkley: Sun suspends Kelvin MacKenzie over Liverpool article,2017-04-15,03:13:07,0,0
445,Steelers owner Dan Rooney Dies,2017-04-14,00:07:47,144,19
446,British former world champion Jenson Button will replace Fernando Alonso at McLaren for the Monaco,2017-04-14,20:30:39,3,0
447,Willie Le Roux Blooper vs Leinster. Champions Cup 2016/17,2017-04-14,20:29:26,3,0
448,"Hang gliding question, all help appreciated!",2017-04-15,01:51:32,1,0
449,Mariners imposing order limit on popular toasted grasshoppers,2017-04-14,18:32:08,3,1
450,Jose Mourinho: Man Utd manager blames forwards for Anderlecht draw,2017-04-14,20:42:43,2,0
451,MLB Team Phone Wallpapers,2017-04-14,20:24:10,2,4
452,Hernandez found not guilty,2017-04-14,23:13:17,0,0
453,What is the most What were you thinking moment in sports history?,2017-04-14,19:16:29,2,9
454,[Discussion] Why are there so many phony/exaggerated fouls in professional sports?,2017-04-14,20:57:23,1,20
455,St. Louis suing NFL over Rams relocation,2017-04-12,22:35:49,6881,843
456,Penguins fan stabbed in head refuses treatment until game is over,2017-04-14,03:47:39,19,2
457,Ducks defeat the Flames to take Game 1 of their first-round playoff series,2017-04-14,16:35:46,1,0
458,Red Wings fans sing Sweet Caroline during the final moments at Joe Louis Arena,2017-04-13,21:24:27,33,5
459,"Question about pay in sports - specifically turf/field hockey, preferentially relevant to Australia",2017-04-14,12:33:50,2,2
460,Money talks,2017-04-13,19:59:18,31,7
461,"The finish of every fight at the inaugural Ultimate Fighting Championship. 11/12/93 in Denver, CO",2017-04-14,01:50:18,9,8
462,Lou Brock undergoing treatment for blood and bone cancer,2017-04-14,01:17:43,9,0
463,A catch almost gets dropped.,2017-04-13,20:49:32,18,5
464,Manuel Neuer with the sick save on a point blank shot from Ronaldo,2017-04-13,12:11:14,83,13
465,Can you Lose weight with a jet ski?,2017-04-14,12:15:22,0,11
466,"If every Canadian NHL team up and left, how much money would the league lose?",2017-04-14,03:59:15,3,4
467,Crimson Tides Deionte Thompson wanted in assault case,2017-04-14,08:28:16,1,2
468,Atlantas New Mercedes Benz Stadium to be home of Superbowl LIII,2017-04-13,22:26:26,5,3
469,"[Squash] Commentators mention how they havent seen Paul Superman Coll dive for a ball yet, then he proceeds to perform two of the most outrageous dives ever to win the point. Commentators at a loss for words.",2017-04-13,12:39:26,21,5
470,"Bill Belichick on leadership, winning, and Tom Brady not being a great natural athlete",2017-04-13,21:00:51,3,2
471,Raiders now only team in NFL to go three years without an arrest,2017-04-12,03:55:43,22251,729
472,Cristiano Ronaldo becomes the first player in history to score 100 goals in UEFA European competition.,2017-04-13,01:09:45,130,16
473,A moment of cricket,2017-04-12,18:04:08,442,92
474,"Women have played college football before, but Becca Longo might be the first on scholarship",2017-04-13,20:42:34,3,4
475,Insane frisbee shot 79 Meter into basketball basket,2017-04-13,14:49:51,6,1
476,Im searching for basketball drills for kids aged 10-13.,2017-04-13,15:35:34,8,1
477,Blake Griffins custom Air Jordans he designed with 10 year old cancer paitent for auction/charity pass $1000 mark. Clippers match $25k to fight childhood cancers,2017-04-12,14:05:03,774,22
478,Eli manning is scamming memorabilia dealers,2017-04-14,04:35:31,0,3
479,"Tanner Glass, oft referred to as the worst player in the NHL, scores a ridiculous game winning goal in the playoffs. (X-Post r/hockey)",2017-04-13,06:55:46,18,7
480,The Edmonton Oilers crowd sings the national anthem at their first Stanley Cup Playoff game in a decade,2017-04-13,12:10:16,6,1
481,Cool article about the possibility of investors buying and selling soccer players like stocks,2017-04-13,11:46:42,6,3
482,[GIF] Julius Blue Machine Indongo (21-0) Knocks Out Eduard Troyanovsky (25-0): KO of the Year 2016,2017-04-13,02:40:36,26,3
483,Batsman changes his Batting Stance after the ball is bowled,2017-04-13,02:51:45,24,16
484,"Shoeless John Daly drives a ball off a beer can and chugs it, all while smoking",2017-04-13,01:50:32,17,1
485,Mike Tyson goes full matrix dodging punches (xpost r/boxing),2017-04-11,18:11:06,9105,937
486,"Proposed bill would force North Carolina, N.C. State to leave ACC due to boycott",2017-04-13,00:54:09,12,19
487,Islamic extremists reported to be behind Borussia Dortmund team bus explosions,2017-04-12,19:57:28,25,14
488,Line Drive Barely Misses Pitchers Head,2017-04-13,01:25:12,7,3
489,"Steph Curry and Steve Kerr of the Golden State Warriors, last game of the regular season VS LA Lakers (our first NBA game)",2017-04-13,11:36:07,0,1
490,"Fernando Alonso, McLaren driver to miss Monaco Grand Prix for Indianapolis 500",2017-04-12,16:00:34,33,10
491,How would the Premier League look if clubs could only use local players?,2017-04-12,16:57:22,24,21
492,Atlanta Braves foam tomahawks cause delays on I-75 near Marietta,2017-04-12,21:54:00,5,2
493,Incredible rugby TRY - Stormers vs Chiefs,2017-04-12,09:24:32,45,3
494,Manchester United players make dreams come true for young fans with life-limiting illnesses,2017-04-12,16:28:20,11,0
495,"Explosion hits bus carrying Borussia Dortmund team,injuring Marc Barta",2017-04-11,22:09:47,208,55
496,DortmundMonaco game postponed after bus explosion,2017-04-12,16:55:09,5,4
497,Bayern vs Real Madrid 1-2 Full Highlights Champions League 12/04/2017 HD,2017-04-13,00:53:26,0,0
498,Fan who Dolan yelled at prevented from renewing season Knicks tickets,2017-04-12,18:17:35,4,2
499,Borussia Dortmund show that football is more than just what happens on the pitch by offering a place to stay for Monaco fans who traveled to Germany ahead of the game which was postponed.,2017-04-12,02:22:58,37,0
500,Good Sportsmanship,2017-04-16,20:57:44,34097,467
501,Singapore 7s: Canada defeats USA to win the nations first-ever cup title,2017-04-16,18:00:02,467,36
502,Crash in formula 4 today,2017-04-16,17:07:47,206,38
503,Tying Shoes Penalty Kick,2017-04-15,20:08:08,46175,917
504,Colombian Goalkeeper Higuita does an amazing SAVE.,2017-04-16,19:27:42,33,16
505,Met Odell this morning at Easter brunch. Nice fellow,2017-04-16,21:50:40,12,3
506,"Today is the 10-Year Anniversary of the Pizza Throw Incident at Fenway Park, May We Never Forget",2017-04-16,00:29:38,225,27
507,Holy Kapanen: Leafs beat Caps in double-OT thriller,2017-04-16,20:45:28,4,0
508,Rally car driver shows off some skill,2017-04-15,04:02:37,41682,1233
509,Aluminum bat snaps in half during bat single,2017-04-16,21:01:07,3,2
510,Best place to watch live soccer matches?,2017-04-16,19:56:43,3,5
511,Amilcar Henriquez was shot and killed in Panamas Colon province,2017-04-16,08:44:40,17,0
512,Chin breaking out from chinstrap. Help!,2017-04-17,00:01:42,1,3
513,Sportstreaming sites,2017-04-16,19:53:39,2,0
514,Dream Team Razors from 1991 STILL at grandmas house,2017-04-16,17:39:46,3,2
515,Ozuna hits Stanton with a liner,2017-04-16,23:36:22,1,0
516,Spending Easter watching the Phillies and Nationals. Go Phillies!!!,2017-04-16,23:17:22,1,1
517,Bastia vs Lyon game postponed as Bastia fans try to attack Lyon players,2017-04-16,23:05:37,1,0
518,Tony Adams bringing a new kind of training technique to Granada...,2017-04-16,22:55:45,1,1
519,"Today marks the 28th anniversary of the Hillsborough tragedy, the day 96 Liverpool fans never came home. Y.N.W.A",2017-04-15,16:05:03,265,21
520,Listen to hilarious telugu commentary on the on-going RCBvsRPS IPL Cricket match.,2017-04-16,21:27:06,0,0
521,Everyone loves surfers,2017-04-16,21:17:30,1,2
522,Rachel Daly With A Nice Curler,2017-04-16,00:37:39,39,4
523,F1 driver Max Verstappen overtakes 9 cars on the first lap on a wet track,2017-04-16,01:32:05,30,1
524,Are there any LGBTQ+ players in the MLB?,2017-04-16,23:08:56,0,9
525,21 bold predictions for the 2017 NBA Playoffs,2017-04-16,15:19:42,2,6
526,The fourth Marathon of Friendship Pleven 2017 will be held at 21 May,2017-04-16,18:46:43,1,0
527,Statue of Jackie Robinson unveiled at Dodger Stadium,2017-04-16,04:25:46,13,1
528,"We are at church, but God is watching the NBA and telling us his MVP picks",2017-04-16,21:26:42,0,1
529,Monger taken to hospital after British F4 crash,2017-04-16,18:53:20,0,1
530,Fingertip control to keep the ball in play - Super Rugby,2017-04-15,20:22:31,29,4
531,Hockey player gets stick stuck in glass,2017-04-14,14:56:22,21979,517
532,Rally driver showing how small the margin for error is,2017-04-15,21:43:30,16,7
533,Gotta love minor league baseball,2017-04-15,08:29:59,177,11
534,Sportsmanship from Matt Calvert in the Waning Seconds of a Loss,2017-04-15,06:37:08,118,47
535,MMA Fighter goes Zombie Mode and pulls one of the greatest comeback in MMA History,2017-04-14,20:15:37,527,65
536,Todd Heap accidentally kills 3 yr old daughter,2017-04-15,08:47:13,36,16
537,David Villa goal from halfway line vs Philly,2017-04-15,08:39:23,36,2
