,Title,Date,Time,Score,Number of Comments
0,Raiders now only team in NFL to go three years without an arrest,2017-04-12,03:55:43,16673,541
1,Mike Tyson goes full matrix dodging punches (xpost r/boxing),2017-04-11,18:11:06,9072,932
2,Blake Griffins custom Air Jordans he designed with 10 year old cancer paitent for auction/charity pass $1000 mark. Clippers match $25k to fight childhood cancers,2017-04-12,14:05:03,399,10
3,How would the Premier League look if clubs could only use local players?,2017-04-12,16:57:22,13,8
4,"Fernando Alonso, McLaren driver to miss Monaco Grand Prix for Indianapolis 500",2017-04-12,16:00:34,13,4
5,Islamic extremists reported to be behind Borussia Dortmund team bus explosions,2017-04-12,19:57:28,5,1
6,A moment of cricket,2017-04-12,18:04:08,7,6
7,"Explosion hits bus carrying Borussia Dortmund team,injuring Marc Barta",2017-04-11,22:09:47,206,43
8,Incredible rugby TRY - Stormers vs Chiefs,2017-04-12,09:24:32,20,2
9,Manchester United players make dreams come true for young fans with life-limiting illnesses,2017-04-12,16:28:20,5,0
10,DortmundMonaco game postponed after bus explosion,2017-04-12,16:55:09,3,4
11,Fan who Dolan yelled at prevented from renewing season Knicks tickets,2017-04-12,18:17:35,2,1
12,Borussia Dortmund show that football is more than just what happens on the pitch by offering a place to stay for Monaco fans who traveled to Germany ahead of the game which was postponed.,2017-04-12,02:22:58,31,0
13,Surez y Chiellini se reencuentran con abrazos y apretones de manos tras el polmico mordisco,2017-04-12,19:47:25,2,0
14,An Americans first soccer game: VfB Stuttgart - Karlsruher SC,2017-04-11,19:19:24,86,13
15,Dele All mejora los nmeros de Cristiano Ronaldo a los 21 aos,2017-04-12,19:26:48,2,0
16,Tony Romo introduced at Mavericks game,2017-04-12,06:22:24,12,11
17,La emotiva carta que Marcus Rashford escribi con slo 11 aos y en la que vaticin su futuro,2017-04-12,19:08:08,1,0
18,NO LO CREA | La cara del cuarto rbitro al ver que entraba Andr Gomes se hace viral en las redes,2017-04-12,18:58:09,1,0
19,Brooklyn Nets will rest Big 6 against playoff-aspiring Bulls,2017-04-12,08:00:02,6,4
20,"Bettor wins $42,000 on a $60 bet for Sergio Garcia to win the Masters",2017-04-12,11:10:58,3,1
21,OTD in 2001 Ichiro made The Throw,2017-04-12,00:32:39,17,2
22,People in Dortmund are offering Monaco fans free accomodation by hashtagging #bedforawayfans,2017-04-12,01:11:41,16,1
23,"Masters green jacket found in thrift store sold at auction for nearly $140,000",2017-04-11,23:19:57,16,0
24,Jonathan Simmons Dunks Over Meyers Leonard,2017-04-11,19:42:01,33,6
25,"Tony Romo, Who Will Wear A Full Uniform And Sit On The Bench Tonight, Practicing With The Mavericks",2017-04-12,00:35:39,9,1
26,Wil Myers Cycle! How is it possible that all 4 of the balls were kept and authenticated. Crazy.,2017-04-11,22:26:07,15,8
27,"Were The Phillies fans just chanting, YOU SUCK, and cespedes hit a 3 run homer?",2017-04-12,03:22:26,5,4
28,Tony Romo joins the Dallas Mavericks for last game of the season.,2017-04-11,23:27:51,10,1
29,Why do people feel the need to film football matches on their phone?,2017-04-12,02:53:32,4,6
30,Wades incredible run-out.,2017-04-11,16:20:03,29,25
31,What if Conor does beat Mayweather?,2017-04-11,19:20:39,6,19
32,Marshawn Lynch Expressed Interest In Joining Patriots If Raiders Deal Falls,2017-04-11,21:38:19,3,4
33,Sergio Garcia wins the 2017 Masters on the first hole of sudden death versus Justin Rose.,2017-04-10,03:30:22,22093,725
34,Walcott-We all let the fans down tonight,2017-04-11,14:19:34,10,3
35,Wil Myers hits for historic cycle with this triple!,2017-04-11,07:43:35,25,6
36,A simple explanation of the rules of cricket,2017-04-11,04:01:53,43,11
37,"Buster Posey Takes Fastball To The Head, Leaves Game",2017-04-11,01:43:43,53,26
38,Tony Romo practicing with his new team.,2017-04-11,23:17:49,1,0
39,"United States, Canada, and Mexico Declare Intention to Submit Unified Bid to Host 2026 FIFA World Cup",2017-04-10,23:04:14,68,25
40,"Rizzo, Cubs raise banner, beat Dodgers 3-2 in home opener",2017-04-11,14:06:07,2,0
41,"Tennis Player Hurdles Into The Stands, Still Returns Shot",2017-04-10,20:53:45,86,11
42,Crystal Palace Fans Taunt Arsenal Manager Arsene Wenger While Leading 3-0,2017-04-11,00:59:00,35,8
43,San Diego State coach Steve Fisher has decided to retire,2017-04-11,07:07:25,8,0
44,"Boxer Slips Punches, Taunts Opponent",2017-04-10,23:41:09,27,3
45,To Cubs fans,2017-04-11,16:43:04,0,1
46,Tristan Jarry makes an unbelievable save in his first ever game,2017-04-10,23:22:25,20,3
47,Boulware Displays All of the Clemson Championship Rings,2017-04-11,00:27:57,15,0
48,"Opening night ceremony, McCoy stadium, Pawtucket, Rhode Island. April 10th, 2017.",2017-04-11,02:21:23,9,0
49,Champions League: Dortmund out to score as many goals as possible against Monaco,2017-04-11,14:47:13,1,2
50,"Buster Posey gets beaned, Giants prevail in home opener",2017-04-11,08:45:00,3,0
51,AB De Villiers showing why they call him the Superman of cricket.,2017-04-11,01:12:08,11,0
52,Phillies to induct Rose into clubs Wall of Fame,2017-04-11,04:07:32,7,1
53,Ric Flair kicked out of Fort Wayne bar for good.,2017-04-10,23:34:04,17,13
54,Great shoemanship by Davey.,2017-04-09,18:11:53,3823,344
55,When Your Team Is Losing After 2 Seconds,2017-04-10,23:24:52,14,4
56,Sparks fly during heated fencing battle,2017-04-10,22:21:59,14,1
57,Brutal Hit in Mississippi State Spring Football Scrimmage,2017-04-10,20:32:49,9,7
58,"Cubs return to Clark and Addison to start their World Series defense, another season of work on Wrigley Field will also be on display.",2017-04-11,06:46:43,0,0
59,"Steve Fisher, former University of Michigan basketball coach of the Fab 5 and current head coach at San Diego State retired today.",2017-04-11,02:42:48,2,1
60,Russell Westbrook Drains Insane Game-Winning Buzzer Beater,2017-04-10,03:36:08,121,42
61,1938 news reel introducing the Ancient Spanish game Jai Alai,2017-04-11,05:04:27,1,0
62,Last octopus in the Joe.,2017-04-10,07:27:04,46,8
63,Last day in the Joe,2017-04-10,04:14:57,77,14
64,ESPN Insider,2017-04-10,23:27:16,2,6
65,Tebow homers again for Mets Class A affiliate,2017-04-10,21:14:56,3,8
66,"Bryan Bickell, retiring from hockey after being diagnosed with multiple Sclerosis, scores his first career shootout goal in his final NHL game.",2017-04-10,07:53:41,29,5
67,Russell Henley drains one during the Masters.,2017-04-09,22:37:00,164,14
68,Sergio Garcia wins the Masters in playoff,2017-04-10,03:30:16,61,3
69,Using your head to fake out the defender,2017-04-10,09:00:47,20,3
70,Sergio Garcia Wins First Masters After Epic Final Day,2017-04-10,03:30:15,51,4
71,Matt Kuchar hits a hole in one on the 16th hole at The Masters,2017-04-10,01:23:21,67,10
72,Insane pass from South African rugby player Dillyn Leyds,2017-04-09,00:01:07,27997,1068
73,MLB Pitcher vs Ballboy,2017-04-09,21:54:48,102,14
74,Bickell scores shootout goal in final game before retirement,2017-04-10,12:57:43,7,1
75,Who knew Johannesburg was in the upper Midwest?,2017-04-09,19:29:13,144,5
76,The Augusta Chronicle. Sergio Garcia is The Masters Champion 2017.,2017-04-10,16:18:12,3,0
77,"Los Angeles Kings play by play announcer of 44 years, Bob Miller, signs off for the final time.",2017-04-10,08:28:12,10,1
78,"Check out my new subreddit r/HorribleGiveaways, a place to post and share the craziest and worst giveaways in sports",2017-04-11,01:00:05,0,0
79,Sergio Garcias Final Putt To Win The Masters,2017-04-10,03:48:36,22,6
80,Sergio Garcia and Justin Rose enter playoff for the Masters title,2017-04-10,03:06:10,29,8
81,"Otis Nixon: Former MLB outfielder reported missing, Georgia police say",2017-04-10,06:22:44,12,0
82,MLS striker throws snowball at defender,2017-04-10,00:06:08,35,1
83,They were inspirational: Female athletes around the world score three wins for equality in matter of days,2017-04-10,19:28:49,2,3
84,Tim Tebow hits 2nd HR in 3 games,2017-04-10,01:51:54,22,7
85,This hockey game was crazy,2017-04-10,03:33:05,14,2
86,Matt Kuchar just hit a hole in one on the 16th at the Masters!,2017-04-10,01:20:37,24,3
87,Damian Lillard scores franchise-record 59 points as Blazers close in on playoff berth,2017-04-10,05:27:51,7,1
88,Immense fight breaks out between the players of two professional Brazilian Football teams after a goalkeeper provokes the fans (09.04.2017),2017-04-10,16:27:10,0,5
89,Incredible pass from South African Rugby player Dillyn Leyds,2017-04-10,04:07:36,8,0
90,My seat @ Orioles v Yankees right now.,2017-04-09,23:23:06,17,5
91,Tehran Hosts First Intl Marathon,2017-04-10,10:40:24,4,0
92,Kwang-Song Han heads home against Torino to become first North Korean to score in Serie A,2017-04-09,19:41:24,31,4
93,Baseball Game Delayed by Balloon or Something,2017-04-09,23:50:16,14,2
94,"Detroit Red Wings Riley Sheahan scores twice in the final game at the Joe Louis Arena, ending a 79-game drought and setting a record for most shots without a goal (106)",2017-04-10,08:07:16,2,1
95,What are the current trends in your sport?,2017-04-10,04:08:58,4,4
96,2008 FIFA U-17 Womens World Cup Final - North Korea vs USA,2017-04-10,06:35:31,2,2
97,Brutal Way to Lose a Match,2017-04-09,21:59:40,8,6
98,Former MLB player Otis Nixon reported missing,2017-04-10,08:34:46,1,0
99,Golf: Whats the worst score to par on a single hole that a player has ever recorded in a major and gone on to win the tournament?,2017-04-09,20:26:04,9,1
100,St. Louis suing NFL over Rams relocation,2017-04-12,22:35:49,6012,665
101,Raiders now only team in NFL to go three years without an arrest,2017-04-12,03:55:43,22181,734
102,A moment of cricket,2017-04-12,18:04:08,413,78
103,Cristiano Ronaldo becomes the first player in history to score 100 goals in UEFA European competition.,2017-04-13,01:09:45,109,13
104,Front flip throw-in leads to an overhead kick goal!,2017-04-13,16:18:53,6,1
105,Manuel Neuer with the sick save on a point blank shot from Ronaldo,2017-04-13,12:11:14,10,3
106,Blake Griffins custom Air Jordans he designed with 10 year old cancer paitent for auction/charity pass $1000 mark. Clippers match $25k to fight childhood cancers,2017-04-12,14:05:03,766,24
107,Tennis Player kicked linesman until he BLEEDS.It boiled over for the Argentine David Nalbandian in the Queens tournament in tennis. He was disqualified for having damaged a Linesman.,2017-04-13,16:11:10,3,5
108,Cool article about the possibility of investors buying and selling soccer players like stocks,2017-04-13,11:46:42,5,2
109,"Tanner Glass, oft referred to as the worst player in the NHL, scores a ridiculous game winning goal in the playoffs. (X-Post r/hockey)",2017-04-13,06:55:46,12,3
110,[GIF] Julius Blue Machine Indongo (21-0) Knocks Out Eduard Troyanovsky (25-0): KO of the Year 2016,2017-04-13,02:40:36,22,1
111,"[Squash] Commentators mention how they havent seen Paul Superman Coll dive for a ball yet, then he proceeds to perform two of the most outrageous dives ever to win the point. Commentators at a loss for words.",2017-04-13,12:39:26,2,1
112,Insane frisbee shot 79 Meter into basketball basket,2017-04-13,14:49:51,3,0
113,"Steph Curry and Steve Kerr of the Golden State Warriors, last game of the regular season VS LA Lakers (our first NBA game)",2017-04-13,11:36:07,3,0
114,Batsman changes his Batting Stance after the ball is bowled,2017-04-13,02:51:45,11,11
115,Mike Tyson goes full matrix dodging punches (xpost r/boxing),2017-04-11,18:11:06,9082,937
116,Im searching for basketball drills for kids aged 10-13.,2017-04-13,15:35:34,0,0
117,"Shoeless John Daly drives a ball off a beer can and chugs it, all while smoking",2017-04-13,01:50:32,11,1
118,The playoff Sharks Of 2016 Go Back Just In Time To Post An OT Victory,2017-04-13,14:19:10,1,0
119,Boxer Lucas Matthysse knocks a man dead (xpost r/boxing),2017-04-13,14:13:36,0,1
120,Islamic extremists reported to be behind Borussia Dortmund team bus explosions,2017-04-12,19:57:28,20,12
121,"Proposed bill would force North Carolina, N.C. State to leave ACC due to boycott",2017-04-13,00:54:09,8,12
122,The Edmonton Oilers crowd sings the national anthem at their first Stanley Cup Playoff game in a decade,2017-04-13,12:10:16,1,0
123,"Fernando Alonso, McLaren driver to miss Monaco Grand Prix for Indianapolis 500",2017-04-12,16:00:34,28,6
124,How would the Premier League look if clubs could only use local players?,2017-04-12,16:57:22,20,15
125,If 3 years ago today someone told you that the Leafs and Oilers would make the playoffs in 2016/17 and the Red Wings would miss... How would you have ranked the likelihood of each?,2017-04-13,07:30:06,1,2
126,Line Drive Barely Misses Pitchers Head,2017-04-13,01:25:12,3,2
127,Atlanta Braves foam tomahawks cause delays on I-75 near Marietta,2017-04-12,21:54:00,3,2
128,Incredible rugby TRY - Stormers vs Chiefs,2017-04-12,09:24:32,39,3
129,Best app to get scores and updates? I dont have time to watch sports much and wanna stay in tune,2017-04-13,04:34:16,0,7
130,Manchester United players make dreams come true for young fans with life-limiting illnesses,2017-04-12,16:28:20,10,0
131,"Explosion hits bus carrying Borussia Dortmund team,injuring Marc Barta",2017-04-11,22:09:47,209,48
132,Who you choosing?,2017-04-13,10:18:08,0,8
133,DortmundMonaco game postponed after bus explosion,2017-04-12,16:55:09,5,4
134,Bayern vs Real Madrid 1-2 Full Highlights Champions League 12/04/2017 HD,2017-04-13,00:53:26,1,0
135,Fan who Dolan yelled at prevented from renewing season Knicks tickets,2017-04-12,18:17:35,3,1
136,Borussia Dortmund show that football is more than just what happens on the pitch by offering a place to stay for Monaco fans who traveled to Germany ahead of the game which was postponed.,2017-04-12,02:22:58,30,0
137,Can someone stop Real Madrid?,2017-04-13,00:42:03,0,3
138,"Watch Pacers, Raptors Scuffle After Lance Stephensons Garbage-Time Layup",2017-04-13,00:19:46,0,1
139,"Bettor wins $42,000 on a $60 bet for Sergio Garcia to win the Masters",2017-04-12,11:10:58,6,2
140,Tony Romo introduced at Mavericks game,2017-04-12,06:22:24,13,14
141,An Americans first soccer game: VfB Stuttgart - Karlsruher SC,2017-04-11,19:19:24,95,13
142,Brooklyn Nets will rest Big 6 against playoff-aspiring Bulls,2017-04-12,08:00:02,5,6
143,OTD in 2001 Ichiro made The Throw,2017-04-12,00:32:39,20,2
144,People in Dortmund are offering Monaco fans free accomodation by hashtagging #bedforawayfans,2017-04-12,01:11:41,15,1
145,"Tony Romo, Who Will Wear A Full Uniform And Sit On The Bench Tonight, Practicing With The Mavericks",2017-04-12,00:35:39,16,3
146,"Masters green jacket found in thrift store sold at auction for nearly $140,000",2017-04-11,23:19:57,18,0
147,Jonathan Simmons Dunks Over Meyers Leonard,2017-04-11,19:42:01,29,6
148,Wil Myers Cycle! How is it possible that all 4 of the balls were kept and authenticated. Crazy.,2017-04-11,22:26:07,15,10
149,"Were The Phillies fans just chanting, YOU SUCK, and cespedes hit a 3 run homer?",2017-04-12,03:22:26,6,5
150,Tony Romo joins the Dallas Mavericks for last game of the season.,2017-04-11,23:27:51,12,1
151,Why do people feel the need to film football matches on their phone?,2017-04-12,02:53:32,3,6
152,Wades incredible run-out.,2017-04-11,16:20:03,31,25
153,What if Conor does beat Mayweather?,2017-04-11,19:20:39,7,21
154,Marshawn Lynch Expressed Interest In Joining Patriots If Raiders Deal Falls,2017-04-11,21:38:19,3,4
155,Sergio Garcia wins the 2017 Masters on the first hole of sudden death versus Justin Rose.,2017-04-10,03:30:22,22090,724
156,Walcott-We all let the fans down tonight,2017-04-11,14:19:34,10,3
157,Wil Myers hits for historic cycle with this triple!,2017-04-11,07:43:35,25,6
158,A simple explanation of the rules of cricket,2017-04-11,04:01:53,42,12
159,"Buster Posey Takes Fastball To The Head, Leaves Game",2017-04-11,01:43:43,55,26
160,Tony Romo practicing with his new team.,2017-04-11,23:17:49,1,0
161,"United States, Canada, and Mexico Declare Intention to Submit Unified Bid to Host 2026 FIFA World Cup",2017-04-10,23:04:14,71,25
162,"Rizzo, Cubs raise banner, beat Dodgers 3-2 in home opener",2017-04-11,14:06:07,5,0
163,"Tennis Player Hurdles Into The Stands, Still Returns Shot",2017-04-10,20:53:45,84,11
164,Crystal Palace Fans Taunt Arsenal Manager Arsene Wenger While Leading 3-0,2017-04-11,00:59:00,30,8
165,San Diego State coach Steve Fisher has decided to retire,2017-04-11,07:07:25,9,0
166,"Boxer Slips Punches, Taunts Opponent",2017-04-10,23:41:09,26,3
167,Tristan Jarry makes an unbelievable save in his first ever game,2017-04-10,23:22:25,24,3
168,To Cubs fans,2017-04-11,16:43:04,1,1
169,Boulware Displays All of the Clemson Championship Rings,2017-04-11,00:27:57,17,0
170,"Opening night ceremony, McCoy stadium, Pawtucket, Rhode Island. April 10th, 2017.",2017-04-11,02:21:23,10,1
171,Champions League: Dortmund out to score as many goals as possible against Monaco,2017-04-11,14:47:13,1,2
172,"Buster Posey gets beaned, Giants prevail in home opener",2017-04-11,08:45:00,3,0
173,AB De Villiers showing why they call him the Superman of cricket.,2017-04-11,01:12:08,10,0
174,Phillies to induct Rose into clubs Wall of Fame,2017-04-11,04:07:32,6,1
175,Ric Flair kicked out of Fort Wayne bar for good.,2017-04-10,23:34:04,14,13
176,Great shoemanship by Davey.,2017-04-09,18:11:53,3814,344
177,When Your Team Is Losing After 2 Seconds,2017-04-10,23:24:52,16,4
178,Sparks fly during heated fencing battle,2017-04-10,22:21:59,13,1
179,Brutal Hit in Mississippi State Spring Football Scrimmage,2017-04-10,20:32:49,8,7
180,"Cubs return to Clark and Addison to start their World Series defense, another season of work on Wrigley Field will also be on display.",2017-04-11,06:46:43,0,0
181,"Steve Fisher, former University of Michigan basketball coach of the Fab 5 and current head coach at San Diego State retired today.",2017-04-11,02:42:48,2,1
182,Russell Westbrook Drains Insane Game-Winning Buzzer Beater,2017-04-10,03:36:08,121,42
183,1938 news reel introducing the Ancient Spanish game Jai Alai,2017-04-11,05:04:27,1,0
184,Last octopus in the Joe.,2017-04-10,07:27:04,49,8
185,Last day in the Joe,2017-04-10,04:14:57,78,14
186,ESPN Insider,2017-04-10,23:27:16,2,6
187,Tebow homers again for Mets Class A affiliate,2017-04-10,21:14:56,4,8
188,"Bryan Bickell, retiring from hockey after being diagnosed with multiple Sclerosis, scores his first career shootout goal in his final NHL game.",2017-04-10,07:53:41,30,5
189,Russell Henley drains one during the Masters.,2017-04-09,22:37:00,163,14
190,Sergio Garcia wins the Masters in playoff,2017-04-10,03:30:16,59,3
191,Using your head to fake out the defender,2017-04-10,09:00:47,17,3
192,Sergio Garcia Wins First Masters After Epic Final Day,2017-04-10,03:30:15,54,4
193,Matt Kuchar hits a hole in one on the 16th hole at The Masters,2017-04-10,01:23:21,64,10
194,Insane pass from South African rugby player Dillyn Leyds,2017-04-09,00:01:07,28016,1067
195,MLB Pitcher vs Ballboy,2017-04-09,21:54:48,103,14
196,Bickell scores shootout goal in final game before retirement,2017-04-10,12:57:43,4,1
197,Who knew Johannesburg was in the upper Midwest?,2017-04-09,19:29:13,145,5
198,The Augusta Chronicle. Sergio Garcia is The Masters Champion 2017.,2017-04-10,16:18:12,3,0
199,"Los Angeles Kings play by play announcer of 44 years, Bob Miller, signs off for the final time.",2017-04-10,08:28:12,12,1
200,Hockey player gets stick stuck in glass,2017-04-14,14:56:22,5649,211
201,Crazy snooker shot from Judd Trump,2017-04-14,01:26:21,1635,99
202,Front flip throw-in leads to an overhead kick goal!,2017-04-13,16:18:53,14703,805
203,[Rugby League] Matt Gillett charge down and game winning pass to James Roberts with 3 minutes left,2017-04-14,16:03:59,10,3
204,Japans volleyball team test their spikes against robot blockers,2017-04-13,18:06:53,446,17
205,Steelers owner Dan Rooney Dies,2017-04-14,00:07:47,137,19
206,Awesome try assist from Anthony Don,2017-04-14,16:38:20,6,1
207,Outside the Lines: The downfall of Americas first sport-only college,2017-04-14,18:39:49,4,0
208,Azizulhasni Awang after 10 years trying to win his first world championship title.,2017-04-14,16:45:06,4,1
209,Mariners imposing order limit on popular toasted grasshoppers,2017-04-14,18:32:08,2,0
210,This year Canadiens playoff pre-game show is out of this world,2017-04-14,15:28:08,3,0
211,St. Louis suing NFL over Rams relocation,2017-04-12,22:35:49,6887,838
212,Bow to the King,2017-04-14,18:49:51,0,0
213,Penguins fan stabbed in head refuses treatment until game is over,2017-04-14,03:47:39,14,1
214,Giants defend Eli Manning amid claim of false memorabilia,2017-04-14,11:15:57,3,1
215,Ducks defeat the Flames to take Game 1 of their first-round playoff series,2017-04-14,16:35:46,1,0
216,"Question about pay in sports - specifically turf/field hockey, preferentially relevant to Australia",2017-04-14,12:33:50,2,1
217,Red Wings fans sing Sweet Caroline during the final moments at Joe Louis Arena,2017-04-13,21:24:27,27,5
218,Money talks,2017-04-13,19:59:18,30,6
219,"The finish of every fight at the inaugural Ultimate Fighting Championship. 11/12/93 in Denver, CO",2017-04-14,01:50:18,8,8
220,Can you Lose weight with a jet ski?,2017-04-14,12:15:22,0,11
221,Manuel Neuer with the sick save on a point blank shot from Ronaldo,2017-04-13,12:11:14,84,13
222,Lou Brock undergoing treatment for blood and bone cancer,2017-04-14,01:17:43,6,0
223,A catch almost gets dropped.,2017-04-13,20:49:32,15,4
224,"WWIII coming right up. Fuck the FBI, fuck Trump, fuck the hells angels, fuck the CIA, fuck big oil, fuck Hootie and the Blowfish.",2017-04-14,18:26:39,0,6
225,"If every Canadian NHL team up and left, how much money would the league lose?",2017-04-14,03:59:15,3,2
226,Crimson Tides Deionte Thompson wanted in assault case,2017-04-14,08:28:16,1,1
227,Atlantas New Mercedes Benz Stadium to be home of Superbowl LIII,2017-04-13,22:26:26,5,3
228,"Bill Belichick on leadership, winning, and Tom Brady not being a great natural athlete",2017-04-13,21:00:51,5,2
229,"[Squash] Commentators mention how they havent seen Paul Superman Coll dive for a ball yet, then he proceeds to perform two of the most outrageous dives ever to win the point. Commentators at a loss for words.",2017-04-13,12:39:26,22,4
230,Raiders now only team in NFL to go three years without an arrest,2017-04-12,03:55:43,22224,731
231,Cristiano Ronaldo becomes the first player in history to score 100 goals in UEFA European competition.,2017-04-13,01:09:45,129,16
232,A moment of cricket,2017-04-12,18:04:08,433,88
233,"Women have played college football before, but Becca Longo might be the first on scholarship",2017-04-13,20:42:34,3,4
234,Insane frisbee shot 79 Meter into basketball basket,2017-04-13,14:49:51,7,1
235,Im searching for basketball drills for kids aged 10-13.,2017-04-13,15:35:34,7,1
236,Eli manning is scamming memorabilia dealers,2017-04-14,04:35:31,0,3
237,Blake Griffins custom Air Jordans he designed with 10 year old cancer paitent for auction/charity pass $1000 mark. Clippers match $25k to fight childhood cancers,2017-04-12,14:05:03,772,22
238,Rips Modest Proposal: End Mens and Womens Divisions in Sports,2017-04-14,03:27:12,0,5
239,"Tanner Glass, oft referred to as the worst player in the NHL, scores a ridiculous game winning goal in the playoffs. (X-Post r/hockey)",2017-04-13,06:55:46,15,7
240,The Edmonton Oilers crowd sings the national anthem at their first Stanley Cup Playoff game in a decade,2017-04-13,12:10:16,7,1
241,Cool article about the possibility of investors buying and selling soccer players like stocks,2017-04-13,11:46:42,4,3
242,Austin Landis is an Olympic hopeful for Team USAs bobsled team,2017-04-13,20:25:54,1,0
243,[GIF] Julius Blue Machine Indongo (21-0) Knocks Out Eduard Troyanovsky (25-0): KO of the Year 2016,2017-04-13,02:40:36,24,3
244,Batsman changes his Batting Stance after the ball is bowled,2017-04-13,02:51:45,21,13
245,"Shoeless John Daly drives a ball off a beer can and chugs it, all while smoking",2017-04-13,01:50:32,16,1
246,Mike Tyson goes full matrix dodging punches (xpost r/boxing),2017-04-11,18:11:06,9095,938
247,"Proposed bill would force North Carolina, N.C. State to leave ACC due to boycott",2017-04-13,00:54:09,12,19
248,Islamic extremists reported to be behind Borussia Dortmund team bus explosions,2017-04-12,19:57:28,27,14
249,If 3 years ago today someone told you that the Leafs and Oilers would make the playoffs in 2016/17 and the Red Wings would miss... How would you have ranked the likelihood of each?,2017-04-13,07:30:06,3,2
250,"Fernando Alonso, McLaren driver to miss Monaco Grand Prix for Indianapolis 500",2017-04-12,16:00:34,33,10
251,Line Drive Barely Misses Pitchers Head,2017-04-13,01:25:12,8,3
252,How would the Premier League look if clubs could only use local players?,2017-04-12,16:57:22,20,16
253,"Steph Curry and Steve Kerr of the Golden State Warriors, last game of the regular season VS LA Lakers (our first NBA game)",2017-04-13,11:36:07,0,0
254,Atlanta Braves foam tomahawks cause delays on I-75 near Marietta,2017-04-12,21:54:00,5,2
255,Incredible rugby TRY - Stormers vs Chiefs,2017-04-12,09:24:32,43,3
256,Manchester United players make dreams come true for young fans with life-limiting illnesses,2017-04-12,16:28:20,11,0
257,"Explosion hits bus carrying Borussia Dortmund team,injuring Marc Barta",2017-04-11,22:09:47,205,55
258,DortmundMonaco game postponed after bus explosion,2017-04-12,16:55:09,5,4
259,Bayern vs Real Madrid 1-2 Full Highlights Champions League 12/04/2017 HD,2017-04-13,00:53:26,0,0
260,Fan who Dolan yelled at prevented from renewing season Knicks tickets,2017-04-12,18:17:35,3,2
261,Borussia Dortmund show that football is more than just what happens on the pitch by offering a place to stay for Monaco fans who traveled to Germany ahead of the game which was postponed.,2017-04-12,02:22:58,35,0
262,"Bettor wins $42,000 on a $60 bet for Sergio Garcia to win the Masters",2017-04-12,11:10:58,6,2
